Flags,Instruction,Category,Intent,Response
BIZ,What types of signage services do you offer?,Services,Signage services,"We offer 3D LED signage, vehicle graphics, vinyl stickers, large format printing, and custom acrylic branding."
BIZ,Can you create custom vehicle graphics?,Services,Vehicle graphics,Absolutely! We provide custom wraps and graphics for all types of vehicles.
BIZ,What materials are used for vinyl stickers?,Product Info,Vinyl materials,Our vinyl stickers are made from high-quality materials suitable for both indoor and outdoor use.
BIZ,Do you offer large format printing services?,Services,Large format printing,"Yes, we offer custom large format printing to bring attention to your brand or product."
BIZ,Can you fabricate custom acrylic stands?,Services,Acrylic stands,Certainly! We create fabricated acrylic stands tailored for promotional and product displays.
BIZ,What are your business hours?,General Info,Business hours,"We are open from Saturday to Thursday, 9:00 am to 6:00 pm."
BIZ,Where are you located?,General Info,Location,"Our address is Industrial Area 13, Near National Paint, Next to Al Gurg Paints, Sharjah, UAE."
BIZ,How can I contact you?,Contact,Contact details,You can call us at +971 55 995 5339 or email us at maliziasign@gmail.com.
BIZ,Do you have a website?,General Info,Website info,"Yes, our website is www.maliziasign.com."
BIZ,Can I view your gallery online?,General Info,Gallery,"Yes, please visit our Gallery page at www.maliziasign.com/Blog."
BIZ,How do I get a quote for a project?,Quote,Request a quote,"You can contact us via phone, email, or through the contact form on our website to request a quote."
BIZ,Do you assist with signage installation?,Services,Installation,"Yes, we provide installation services by experienced technicians."
BIZ,What is your experience in the signage industry?,Company Info,Experience,"We have over 15 years of experience, having completed more than 25,000 successful projects and manufactured over 1 million signs."
BIZ,Who are some of your clients?,Company Info,Clients,"We have served over 750 clients, including multinational organizations such as Coca-Cola, Pepsi, and Unilever."
BIZ,Do you offer signage design services?,Services,Design,"Yes, we offer professional signage design services tailored to your brand."
BIZ,Can you help with signboard approvals or permits?,Services,Permits,We can guide you on signboard approvals and help ensure compliance with local regulations.
BIZ,What is the turnaround time for a signage project?,Services,Turnaround time,"Depending on the project scope, it typically takes 3-7 working days. Custom projects may take longer."
BIZ,Can I see samples of your previous work?,General Info,Samples,"Yes, you can view our work in the Gallery section on our website or request a portfolio."
BIZ,Do you offer warranty on your signage products?,Product Info,Warranty,"Yes, we provide a warranty depending on the material and type of signage. Please contact us for details."
BIZ,What types of businesses do you serve?,Company Info,Customer types,"We work with retail stores, restaurants, corporate offices, vehicle fleets, and more."
BIZ,Do you provide installation outside Sharjah?,Services,Installation outside Sharjah,"Yes, we serve all Emirates and can accommodate installations beyond Sharjah."
BIZ,Do you offer maintenance services for signage?,Services,Maintainance,"Yes, we offer maintenance and repair services for signage and LED displays."
BIZ,Can you produce bilingual signage (Arabic/English)?,Services,Bilingual signage,"Absolutely, we specialize in bilingual and multilingual signage for the UAE market."
BIZ,Do you accept urgent or express orders?,Services,Urgent orders,"Yes, we offer expedited service for urgent signage needs. Additional charges may apply."
BIZ,What is your pricing structure?,Quote,Pricing,"Pricing depends on size, materials, complexity, and quantity. Contact us for a custom quote."
BIZ,Can I schedule an appointment for consultation?,Services,Consultation,"Yes, you can call or email us to schedule a consultation at our office or your location."
BIZ,Is delivery available for signage products?,Services,Delivery,"Yes, we provide delivery services across the UAE. Delivery fees may vary based on location."
BIZ,Do you have customer testimonials?,General Info,Testimonials,"Yes, our satisfied clients often share testimonials, and we�d be happy to provide them on request."
BIZ,What is the process to place an order?,Order Process,Order Process,"To place an order, simply contact us through our phone number or email, or fill out the contact form on our website. Our team will guide you through the process."
BIZ,Do you offer custom designs for signage?,Custom Design,Custom Design,"Yes, we provide fully custom designs tailored to your brand's needs. Our design team will work closely with you to create the perfect signage."
BIZ,Can I get a digital proof before production?,Proof Approval,Proofs,"Yes, we offer digital proofs for approval before starting production to ensure that the design meets your expectations."
BIZ,Are your signage materials weatherproof?,Product Info,Weatherproof,"Yes, we use high-quality weatherproof materials suitable for both indoor and outdoor environments, ensuring durability in all conditions."
BIZ,How long does it take to receive a quote?,Quote,Quote Process,"Typically, we respond with a quote within 1-2 business days after receiving your inquiry and project details."
BIZ,Do you offer eco-friendly signage options?,Eco-friendly,Eco-friendly,"Yes, we provide eco-friendly signage options made from recyclable materials. Let us know your preferences, and we will help you choose the best solution."
BIZ,Can you help with sign permits for my project?,Permits,Permits,"Yes, we can assist you with obtaining the necessary permits for your signage project, ensuring compliance with local regulations."
BIZ,Do you provide installation for international clients?,International,International Services,"We primarily serve the UAE, but we can help coordinate installation services for international clients through our trusted partners."
BIZ,How do I maintain my signage?,Maintenance,Maintenance,"We recommend regular cleaning and maintenance to ensure your signage stays in top condition. If repairs are needed, we offer maintenance services to keep your signage functional."
BIZ,Do you offer a satisfaction guarantee?,Warranty,Satisfaction Guarantee,"Yes, we offer a satisfaction guarantee for our signage products. If you're not satisfied with the final product, we will work with you to make it right."
BIZ,Can I view your home page?,General Info,Home,"Yes, please visit our Home page at www.maliziasign.com."
BIZ,Can I view your clients list online?,General Info,Clients,"Yes, please visit our Clients page at www.maliziasign.com/Clients."
BIZ,Can I view your services online?,General Info,Services,"Yes, please visit our Services page at www.maliziasign.com/Services."
BIZ,Can I view your project portfolio?,General Info,Projects,"Yes, please visit our Projects page at www.maliziasign.com/Projects."
BIZ,Are you hiring currently?,General Info,Careers,"Yes, please visit our Careers page at www.maliziasign.com/Careers for openings."
BIZ,Can I learn more about your company?,General Info,About Us,"Yes, please visit our About Us page at www.maliziasign.com/About."
BIZ,How can I contact you?,General Info,Contact Us,"Yes, please visit our Contact Us page at www.maliziasign.com/Contact."
